{"checks":[{"id":"non_directive","message":"Non-directive language enforced.","status":"PASS"},{"id":"stop_state","message":"Stop not requested.","status":"PASS"},{"id":"freeze_state","message":"Freeze not requested.","status":"PASS"},{"id":"ambiguity","message":"Ambiguity flagged.","status":"FLAG"},{"id":"contradiction","message":"No contradiction.","status":"PASS"}],"delta":{"minimal_change":"clarification_needed: disambiguate_request"},"refusal":null,"run_header":{"contract_version":"1.0","input_hash":"a3e596b39495476143b15e959658b9dfc41afd780ec688e2858e53da49cff39e","model_version":"CogA-1.0-pro","reasoning_pack_id":"default","reasoning_pack_version":"1.0","schema_version":"1.0"},"status":"UNCLEAR"}