{"checks":[{"id":"non_directive","message":"Non-directive language enforced.","status":"PASS"},{"id":"stop_state","message":"Stop not requested.","status":"PASS"},{"id":"freeze_state","message":"Freeze not requested.","status":"PASS"},{"id":"ambiguity","message":"No ambiguity flagged.","status":"PASS"},{"id":"contradiction","message":"No contradiction.","status":"PASS"}],"delta":null,"refusal":null,"run_header":{"contract_version":"1.0","input_hash":"86f949d0197a65412bc1886c9c581febcd301114c8f985007dd747376b4d9c8d","model_version":"CogA-1.0-pro","reasoning_pack_id":"default","reasoning_pack_version":"1.0","schema_version":"1.0"},"status":"COMPLETE"}